{
  "schema_version": "1.0",
  "cycle_id": "20260426-1500-thread-b-retraction",
  "title": "[RETRO] Thread B LOH×AF×CN whitelist filter cross-sample retraction",
  "hypothesis_id": "RETRO_THREAD_B_04-26",
  "phase": "P5_EVALUATE",
  "tier": "RETRACTED",
  "verdict": "blocked",
  "priority": 60,
  "started_at": "2026-04-22T10:00:00Z",
  "last_advanced_at": "2026-04-26T16:00:00Z",
  "preconditions": {
    "binary_version": null,
    "dataset_id": "X6_caller_AF_post_KDE_corrected_2026-04-24",
    "upstream_reports": [
      "InterSubMod/docs/reports/validated/2026/04/20260426_Thread_B_Retraction_Whitelist_Cross_Sample_01.md",
      "InterSubMod/docs/experiments/in_progress/2026/04/20260424_X6_Caller_AF_S3S5_CrossSample_01.md"
    ]
  },
  "open_gates": [
    {
      "gate": "P5_EVALUATOR",
      "status": "open",
      "reason": "expected: cross-sample consistency 1/6 critical → pending_review (Wilcoxon W=0 p=1)"
    }
  ],
  "artifacts": {
    "plan": "plan.json",
    "precheck": null,
    "pilot": "pilot.json",
    "generalize": "generalize.json",
    "evaluation": null
  },
  "history": [
    {
      "timestamp": "2026-04-22T10:00:00Z",
      "from_phase": null,
      "to_phase": "P0_REGISTER",
      "actor": "user"
    },
    {
      "timestamp": "2026-04-26T16:00:00Z",
      "from_phase": "P4_GENERALIZE",
      "to_phase": "P5_EVALUATE",
      "actor": "user",
      "note": "X6 cross-sample 反證 → 撤回宣告"
    }
  ],
  "failure_attribution": {
    "categories": [
      "consistency_violation",
      "confound_bias"
    ],
    "primary_category": "consistency_violation",
    "phase_at_failure": "P5_EVALUATE",
    "skill_at_failure": "run-evaluator",
    "gate_at_failure": "P5_EVALUATOR",
    "components_below_threshold": [
      "multi_sample_consistency=0.17",
      "effect_size_stability=0.14",
      "pitfall_coverage_score=0.00"
    ],
    "pitfalls_hit": [
      "P-11"
    ],
    "confidence": "high",
    "diagnosed_at": "2026-05-09T17:34:45Z",
    "auto_recovery_attempted": false,
    "auto_recovery_succeeded": null,
    "user_intervention_required": true
  }
}
